{"$schema":"https://json-schema.org/draft/2020-12/schema","title":"GTS scoped verification v0.1","type":"object","additionalProperties":false,"required":["protocol_version","subject_sha256","verifier_id","independence","scope","tests","limitations"],"properties":{"protocol_version":{"const":"0.1"},"subject_sha256":{"type":"string","pattern":"^[a-f0-9]{64}$"},"verifier_id":{"type":"string","minLength":1},"independence":{"enum":["internal","external"]},"scope":{"type":"string","minLength":1},"tests":{"type":"array","minItems":1,"items":{"type":"object","required":["case_id","verdict","observation_ref"],"properties":{"case_id":{"type":"string"},"verdict":{"enum":["verified_within_scope","falsified","inconclusive","not_exercised","unreachable","unverifiable"]},"observation_ref":{"type":["string","null"]}}}},"limitations":{"type":"array","items":{"type":"string"}}}}
